{
  "schema_version": 1,
  "game_id": "lantern-dusk",
  "revision": "lantern-dusk.pack.v1",
  "mode": "guided",
  "title": "暮灯镇的失踪信使",
  "description": "一场小型调查冒险：雨夜的旧渡口客栈里，失踪的信使留下了一封没有寄出的信。",
  "gameplay": "围绕失踪信使展开一场雨夜调查。可以交谈、观察、调查或等待；参与、拒绝与错失机会会影响阶段结果。",
  "background": "旧渡口是暮灯镇的河运入口，雨夜的客栈接待等船和避雨的人。",
  "rules": "保持小型调查冒险的时代与物件一致，不引入现代科技或超自然力量。",
  "author_facts": "沈岚在柜台下藏着一枚染血的信蜡，知道失踪信使曾在今晚来过；铁杉只注意到有人和沈岚低声交谈过，不知道谈话内容。",
  "player": {
    "name": "旅人",
    "profile": "一个正在寻找答案的旅人。",
    "requirements": "你是一位刚到旧渡口的旅人，可以自定义姓名与背景。",
    "editable": true
  },
  "opening": "雨水顺着旧渡口客栈的屋檐落下。壁炉旁的老板沈岚擦拭着一只空酒杯，佣兵铁杉坐在窗边，目光落在黑沉沉的河面。门口还挤着十来个避雨的客人。就在你推门时，柜台下传来一声短促的金属碰撞。",
  "initial_location": "inn",
  "clock": "第 1 日 19:00",
  "locations": [
    {
      "id": "inn",
      "name": "旧渡口客栈",
      "description": "雨夜的客栈，有大堂、柜台和后屋。",
      "connections": [
        "dock"
      ]
    },
    {
      "id": "dock",
      "name": "旧渡口码头",
      "description": "客栈外的码头，停靠往来渡船。",
      "connections": [
        "inn",
        "warehouse"
      ]
    },
    {
      "id": "warehouse",
      "name": "渡口仓棚",
      "description": "码头附近的河运仓棚。",
      "connections": [
        "dock"
      ]
    }
  ],
  "npcs": [
    "npcs/innkeeper.json",
    "npcs/mercenary.json"
  ],
  "bystanders": [
    "卖花的老人",
    "戴蓝围巾的学生",
    "赶车人",
    "河运工",
    "带孩子的旅客",
    "醉酒的木匠",
    "灰帽商人",
    "修钟匠",
    "披斗篷的妇人",
    "打瞌睡的船夫"
  ],
  "plot": {
    "revision": "lantern-dusk.plot.v2",
    "facts": "故事限于旧渡口客栈、码头、渡口仓棚。末班夜渡在第一日20:00离岸。失踪信使名为陆舟，负伤后藏在仓棚，携带河运账目被篡改的证据，信蜡留在沈岚柜台下。沈岚只知道他来过和信蜡；铁杉只知道客栈异常，不自动知道信使位置。追索账目的陌生人会在渡船离岸前寻找信使。固定事实不得为了满足预设结局改写。未来节点是可受玩家和人物行动改变的计划。",
    "nodes": [
      {
        "id": "dock_warning",
        "at_minute": 1145,
        "after": [],
        "audience": [
          "player",
          "npc:innkeeper",
          "npc:mercenary"
        ],
        "terminal": false,
        "condition": "码头夜渡准备开始，未曾发生本节点。",
        "development": "外部新刺激：码头传来催渡铃，河运工在他实际在场处提醒末班船将在戌初（20:00）离岸，并提及仓棚有人需要帮助。只向实际听到者投影消息；玩家已离开且未获知时不全知广播。重要NPC若要查看、提醒或处置，先交给本人作决定，节点本身不预写其选择。"
      },
      {
        "id": "courier_window",
        "at_minute": 1170,
        "after": [
          "dock_warning"
        ],
        "audience": [
          "player",
          "npc:innkeeper",
          "npc:mercenary"
        ],
        "terminal": false,
        "condition": "确认信使在这个时点的处境：依据此前已经成立的营救、转移、预警、阻拦或未干预。",
        "development": "未干预时，寻人的陌生人到仓棚外，信使仍有走侧门到渡船的机会；已经转移或有人阻拦时，追索者按实际线索行动，不强行把信使移回仓棚。只呈现当前外部事件与风险，不替玩家接受任务。相关重要NPC需要新的选择时请求本人。只让目击者或实际收到消息者知道，不把未来去向直接广播。"
      },
      {
        "id": "night_outcome",
        "at_minute": 1200,
        "after": [
          "courier_window"
        ],
        "audience": [
          "player",
          "npc:innkeeper",
          "npc:mercenary"
        ],
        "terminal": true,
        "condition": "夜渡离岸，依据已提交行动和证据确认本段调查的阶段结果。",
        "development": "已救出信使并取得证据时可形成证据保全的结束；干预阻止追索而未取证时保留相应真实结果。完全不参与时，信使可沿侧门自行上船离开，追索者失去踪迹，玩家错过当夜当面调查机会；如已发生受伤、受阻等改变则依据实际结果，不强行离开。流程型可在本段结果成立时结束，开放型仅结束这一事件，世界仍可继续。仅通过实际可感知的船离岸、目击或转述告知玩家；未获知具体去向不能在正文揭示。"
      }
    ]
  }
}
