{
  "schema_version": 1,
  "game_id": "lantern-dusk",
  "revision": "lantern-dusk.pack.v2",
  "mode": "guided",
  "title": "暮灯镇的失踪信使",
  "description": "一场小型调查冒险：雨夜的旧渡口客栈里，失踪的信使留下了一封没有寄出的信。",
  "gameplay": "在末班夜渡离岸前，决定是否调查失踪信使。可以询问、走访码头与仓棚、寻求帮助，也可以拒绝或等待。故事在当夜的机会结束时收束，结果取决于实际行动，不要求唯一解法。",
  "background": "暮灯镇靠河运生活。旧渡口客栈在码头石阶上方，仓棚沿栈道步行几分钟可到。镇上的消息常由船夫、搬运工和客栈往来传递。今晚雨势渐紧，末班夜渡将在20:00离岸，之后封渡至天明。客栈仍可留宿，错过渡船并不意味着生命危险。",
  "rules": "这是没有现代科技和超自然力量的小型调查冒险。相邻地点需要实际步行；河雨影响视线和声音，听闻不等于亲见。查看显露的物件通常可行，拿走他人物品、营救、胁迫或作出承诺需要玩家表达意图并由协调处理结果。问路和拒绝都能继续，线索不要求按固定顺序发现。重要人物的帮助或拒绝由本人决定。20:00是当夜事件的边界，不把等待自动解释为接受任务。",
  "author_facts": "沈岚在柜台下藏着一枚染血的信蜡，知道失踪信使曾在今晚来过；铁杉只注意到有人和沈岚低声交谈过，不知道谈话内容。",
  "player": {
    "name": "旅人",
    "profile": "一个正在寻找答案的旅人。",
    "requirements": "你是一位刚到旧渡口的旅人，可以自定义姓名与背景。",
    "editable": true
  },
  "opening": "雨水顺着旧渡口客栈的屋檐落下。壁炉旁的老板沈岚擦拭着一只空酒杯，佣兵铁杉坐在窗边，目光落在黑沉沉的河面。门口还挤着十来个避雨的客人。就在你推门时，柜台下传来一声短促的金属碰撞。",
  "initial_location": "inn",
  "clock": "第 1 日 19:00",
  "locations": [
    {
      "id": "inn",
      "name": "旧渡口客栈",
      "description": "大堂接待避雨与候船的客人，柜台后通向后屋。窗外可见码头灯光，雨声使低声交谈难以跨桌听清。柜台内部不是公共陈列区。",
      "connections": [
        "dock"
      ]
    },
    {
      "id": "dock",
      "name": "旧渡口码头",
      "description": "石阶下接木栈道与候船棚，夜渡停在外侧泊位。公告牌写着末班20:00，搬运工可提供自己目击过的消息；栈道通向仓棚。",
      "connections": [
        "inn",
        "warehouse"
      ]
    },
    {
      "id": "warehouse",
      "name": "渡口仓棚",
      "description": "堆放空麻袋与木箱的河运棚屋，正门对栈道，侧门通往渡船方向。棚内可避雨，物件与角落需走近观察。",
      "connections": [
        "dock"
      ]
    }
  ],
  "npcs": [
    "npcs/innkeeper.json",
    "npcs/mercenary.json"
  ],
  "bystanders": [
    "卖花的老人",
    "戴蓝围巾的学生",
    "赶车人",
    "河运工",
    "带孩子的旅客",
    "醉酒的木匠",
    "灰帽商人",
    "修钟匠",
    "披斗篷的妇人",
    "打瞌睡的船夫"
  ],
  "plot": {
    "revision": "lantern-dusk.plot.v3",
    "facts": "故事限于客栈、码头、仓棚。末班夜渡第一日20:00离岸。起始事实：信使陆舟腿部擦伤但能扶物行走，藏在仓棚麻袋后，携带一页有原始签押的河运账目，显示税款被重复征收；他来过客栈，染血信蜡留在沈岚柜台下。沈岚只知道他来过和信蜡；铁杉只注意到异常，不知道藏身处。陆舟、船夫和两名追索者属于背景人物，由协调按处境处理，不创建新的重要NPC。陆舟希望保住账页并乘夜渡到对岸递交；面对明确善意与可行帮助可以解释自己的处境或出示账页，是否交出原件取决于安全，不要求玩家承诺或取得某一NPC许可才可接触他。玩家可循搬运工的目击、脚印、询问或实际搜索找到仓棚线索，也可直接到仓棚观察。护送、藏匿、保全副本、求助、拒绝均按实际结果发展。追索者想拿回账页，不无条件杀人；阻拦、误导和公开见证可能改变搜寻，效果要有已成立行动依据。账页位置、陆舟伤势和所在地点以最新结果为准。20:00结算可为信使与证据安全离开、证据另行保全、帮助受阻或错过当面调查；不强行汇入同一结局，不揭示玩家未获知的后台真相。",
    "nodes": [
      {
        "id": "dock_warning",
        "at_minute": 1145,
        "after": [],
        "audience": [
          "player",
          "npc:innkeeper",
          "npc:mercenary"
        ],
        "terminal": false,
        "condition": "码头夜渡准备开始，未曾发生本节点。",
        "development": "外部新刺激：码头传来催渡铃，河运工在他实际在场处提醒末班船将在戌初（20:00）离岸，并提及仓棚有人需要帮助。只向实际听到者投影消息；玩家已离开且未获知时不全知广播。重要NPC若要查看、提醒或处置，先交给本人作决定，节点本身不预写其选择。"
      },
      {
        "id": "courier_window",
        "at_minute": 1170,
        "after": [
          "dock_warning"
        ],
        "audience": [
          "player",
          "npc:innkeeper",
          "npc:mercenary"
        ],
        "terminal": false,
        "condition": "确认信使在这个时点的处境：依据此前已经成立的营救、转移、预警、阻拦或未干预。",
        "development": "未干预时，寻人的陌生人到仓棚外，信使仍有走侧门到渡船的机会；已经转移或有人阻拦时，追索者按实际线索行动，不强行把信使移回仓棚。只呈现当前外部事件与风险，不替玩家接受任务。相关重要NPC需要新的选择时请求本人。只让目击者或实际收到消息者知道，不把未来去向直接广播。"
      },
      {
        "id": "night_outcome",
        "at_minute": 1200,
        "after": [
          "courier_window"
        ],
        "audience": [
          "player",
          "npc:innkeeper",
          "npc:mercenary"
        ],
        "terminal": true,
        "condition": "夜渡离岸，依据已提交行动和证据确认本段调查的阶段结果。",
        "development": "末班渡船离岸，当夜当面调查窗口关闭。本节点结束这段故事：已护送上船且证据在安全持有者手中，确认保全；只救人或只保全副本，确认部分成果；实际阻拦失败或证据被取走，确认相应受挫结果。完全未干预时陆舟可循侧门自行上船，玩家错过当面调查；此前若已受阻则按事实结算，不强行移动。Ending明确概括玩家实际获得的阶段结果，不要求完美成功才可结束。以本轮时钟和已提交行动为证据，不把说过想帮忙当成已经救出。只通过船声、目击或有来源转述向玩家投影结果；未获知陆舟去向时，玩家只知道末班已走和机会已过。"
      }
    ]
  }
}
